{"name":"benchmark","description":"Provides utilities for virtual machines (VMs) that execute benchmarks","long_description":"# benchmark-cookbook\n\nProvides utilities for virtual machines (VMs) that execute benchmarks\n\n## Supported Platforms\n\nTested on the following platforms:\n\n* Ubuntu 12.04 64 bit\n* Ubuntu 13.10 64 bit\n\n## Attributes\n\nSee comments in /attributes/default.rb\n\n\n## Usage\n\n### benchmark::default\n\nInclude `benchmark` in your node's `run_list`:\n\nYou may specify a specific version with recipe[benchmark@0.2.0]\"\n\n```json\n{\n  \"run_list\": [\n    \"recipe[benchmark::default]\"\n  ]\n}\n```\n\n```ruby\nconfig.vm.provision \"chef_client\" do |chef|\n  chef.add_recipe \"benchmark\"\nend\n```\n\n\n## License and Authors\n\nAuthor:: seal uzh (<joel.scheuner.dev@gmail.com>)\n","maintainer":"seal uzh","maintainer_email":"joel.scheuner.dev@gmail.com","license":"Apache 2.0","platforms":{},"dependencies":{},"recommendations":{},"suggestions":{},"conflicting":{},"providing":{},"replacing":{},"attributes":{},"groupings":{},"recipes":{},"version":"0.2.0"}